{"extractedLyrics": "When the dawn starts to creep Back into the sky and it's time to leave We can still feel the drone And it's pulling us right back to where we've begun", "extractedLyrics_en": "When the dawn starts to creep Back into the sky and it's time to leave We can still feel the drone And it's pulling us right back to where we've begun", "detectedLanguage": "en", "explicitness": {"toxicity": 0.0013601661194115877, "severe_toxicity": 0.0001169632887467742, "obscene": 0.00018989984528161585, "threat": 0.0001329302176600322, "insult": 0.00018336044740863144, "identity_attack": 0.00018879494746215641}}